shop_name,address,latitude,longitude,city,postcode
Audioprothésiste Plabennec Audition Santé,9 place Général de Gaulle 29860 Plabennec FR,48.502033,-4.427095,Plabennec,29860
Audioprothésiste Ploemeur Audition Santé,21 place de l'église 56270 Ploemeur FR,47.736345,-3.427777,Ploemeur,56270
Audioprothésiste Plouay Audition Santé,9 rue du Général de Gaulle 56240 Plouay FR,47.915432,-3.335667,Plouay,56240
Audioprothésiste Plougastel Audition Santé,8 Place du Calvaire Opticien ATOL 29470 Plougastel FR,48.374327,-4.369083,Plougastel-Daoulas,29470
Audioprothésiste Plouharnel Audition Santé,10 Avenue d'Auray 56340 Plouharnel FR,47.59934,-3.111073,Plouharnel,56340
Audioprothésiste La Trinité Plouzané Audition Santé,Place du Commerce La Trinité Plouzané 29280 Plouzané FR,48.37176,-4.589973,Plouzané,29280
Audioprothésiste Pont de Cheruy Audition Santé,Parking Carrefour Market - Rue des Aubépines 38230 Pont de Cheruy FR,45.752297,5.174717,Pont-de-Chéruy,38230
Audioprothésiste Pont-de-Vaux Audition Santé,44 rue du Maréchal De Lattre de Tassigny Chez Optique WOLFF 01190 Pont-de-Vaux FR,46.431194,4.937265,Pont-de-Vaux,01190
Audioprothésiste Pontcharra Audition Santé,725 avenue de la Gare 38530 Pontcharra FR,45.433806,6.012334,Pontcharra,38530
Audioprothésiste Pontorson Audition Santé,45 rue de Couesnon 50170 Pontorson FR,48.553094,-1.509769,Pontorson,50170
Audioprothésiste Notre Dame de Gravenchon Audition Santé,16 Centre Commercial de la Hétraie Notre Dame de Gravenchon 76330 Port-Jérôme-sur-Seine FR,49.490071,0.566214,Port-Jérôme-sur-Seine,76330
Audioprothésiste Port-Louis Audition Santé,"36, Grande Rue 56290 Port-Louis FR",47.707496,-3.355031,Port-Louis,56290
Audioprothésiste Pouilly en Auxois Audition Santé,2 rue du Foirail (Maison de Santé) 21320 Pouilly en Auxois FR,47.266868,4.550852,Pouilly-en-Auxois,21320
Audioprothésiste Prayssac Audition Santé,5 avenue Maréchal Bessières 46220 Prayssac FR,44.50373,1.188021,Prayssac,46220
Audioprothésiste Puylaurens Audition Santé,6 rue du Marché 81700 Puylaurens FR,43.571957,2.01404,Puylaurens,81700
Audioprothésiste Péage-de-Roussillon Audition Santé,12 place Paul Morand 38550 Péage-de-Roussillon FR,45.372823,4.796672,Le Péage-de-Roussillon,38550
Audioprothésiste Pézenas Audition Santé,6 rue Jean Pierre Lagarde Chez Opticien Vision Center 34120 Pézenas FR,43.446862,3.411607,Pézenas,34120
Audioprothésiste Rabastens Audition Santé,3 place St Michel 81800 Rabastens FR,43.82215,1.724086,Rabastens,81800
Audioprothésiste Rambouillet AuditionSanté,91 rue d'Angiviller 78120 Rambouillet FR,48.643416,1.829459,Rambouillet,78120
Audioprothésiste Remiremont Audition Santé,33-35 rue Charles de Gaulle Chez Optique Vosgienne 88200 Remiremont FR,48.017301,6.590192,Remiremont,88200
Audioprothésiste Rennes Audition Santé,97 rue de l’Alma 35000 Rennes FR,48.095774,-1.674739,Rennes,35000
Audioprothésiste Rennes Audition Santé,149 Rue de Fougères 35700 Rennes FR,48.351577,-1.204613,Fougères,35300
Audioprothésiste Rennes Audition Santé,3 rue de Nemours 35000 Rennes FR,48.108948,-1.680068,Rennes,35000
Audioprothésiste Romilly-sur-Seine Audition Santé,10 rue de la Boule d'Or 10100 Romilly-sur-Seine FR,48.519078,3.726398,Romilly-sur-Seine,10100
Audioprothésiste Saint-dié des Vosges Audition Santé,35 rue Saint Charles 88100 SAINT DIE LES VOSGES FR,48.287982,6.953793,Saint-Dié-des-Vosges,88100
Audioprothésiste Saint Brevin Les Pins Audition Santé,268 Avenue de Mindin 44250 Saint Brevin Les Pins FR,47.247243,-2.165314,Saint-Brevin-les-Pins,44250
Audioprothésiste Saint Nazaire Audition Santé,1 Avenue de la république 44600 Saint Nazaire FR,47.274338,-2.213728,Saint-Nazaire,44600
Audioprothésiste Saint-Amand-Montrond Audition Santé,8 rue du Docteur Coulon 18200 Saint-Amand-Montrond FR,46.721953,2.503773,Saint-Amand-Montrond,18200
Audioprothésiste Saint-Ambroix Audition Santé,14 rue de la République 30500 Saint-Ambroix FR,44.26013,4.199184,Saint-Ambroix,30500
Audioprothésiste Saint-André-de-Cubzac Audition Santé,73 rue Emile Dantagnan Espace Vision (En face pharmacie Saint André) 33240 Saint-André-de-Cubzac FR,44.994141,-0.44196,Saint-André-de-Cubzac,33240
Audioprothésiste Saint-André-de-Cubzac Jules Ferry AuditionSanté,1 205 avenue Jules Ferry 33240 Saint-André-de-Cubzac FR,45.002786,-0.430615,Saint-André-de-Cubzac,33240
Audioprothésiste Saint-Brieuc Audition Santé,9 boulevard Clemenceau 22000 Saint-Brieuc FR,48.510189,-2.759365,Saint-Brieuc,22000
Audioprothésiste Caen Saint-Contest AuditionSanté,10 rue Jane Addams 14280 Saint-Contest FR,49.207067,-0.390542,Saint-Contest,14280
Audioprothésiste Saint-Girons Audition Santé,9 rue Villefranche 09200 Saint-Girons FR,42.985126,1.141553,Saint-Girons,09200
Audioprothésiste Saint-Hilaire-du-Harcouët Audition Santé,"13 avenue du Maréchal Leclerc Chez LISSAC Opticien, Brige Optique 50600 Saint-Hilaire-du-Harcouët FR",48.577631,-1.092569,Saint-Hilaire-du-Harcouët,50600
Audioprothésiste Saint-Junien Audition Santé,14 place de la Bourse 87200 Saint-Junien FR,45.861519,0.909374,Saint-Junien,87200
Audioprothésiste Saint-Magne-de-Castillon Audition Santé,1 avenue de l’Europe Chez Castimedic 33350 Saint-Magne-de-Castillon FR,44.854336,-0.052279,Saint-Magne-de-Castillon,33350
Audioprothésiste Saint-Marcel Audition Santé,Rue des Chaumes Galerie marchande Intermarché 27950 Saint-Marcel FR,49.100906,1.455002,Saint-Marcel,27950
Audioprothésiste Saint-Médard-en-Jalles Audition Santé,56 avenue Montesquieu 33160 Saint-Médard-en-Jalles FR,44.895485,-0.716738,Saint-Médard-en-Jalles,33160
Audioprothésiste Saint-Quentin AuditionSanté,17 rue Croix Belle Porte 02100 Saint-Quentin FR,49.847699,3.287394,Saint-Quentin,02100
Audioprothésiste Saint-Rémy-de-Provence Audition Santé,4 bis avenue de la 1ère division française libre 13210 Saint-Rémy-de-Provence FR,43.795274,4.827528,Saint-Rémy-de-Provence,13210
Audioprothésiste Saint-Sébastien-sur-Loire Audition Santé,101 bis rue de la libération Cours de la Martellière 44230 Saint-Sébastien-sur-Loire FR,47.199826,-1.519603,Saint-Sébastien-sur-Loire,44230
Audioprothésiste Saint-Victoret Audition Santé,10 avenue Jacques Prevert Espace Commercial La Lauvette 13730 Saint-Victoret FR,43.419886,5.233615,Saint-Victoret,13730
Audioprothésiste Saint-Yrieix-la-Perche Audition Santé,24 place de la Nation 87500 Saint-Yrieix-la-Perche FR,45.51096,1.201591,Saint-Yrieix-la-Perche,87500
Audioprothésiste Saint-Éloy-les-Mines Audition Santé,192 rue Jean Jaurès 63700 Saint-Éloy-les-Mines FR,46.161398,2.834013,Saint-Éloy-les-Mines,63700
Audioprothésiste Sainte-Foy-lès-Lyon Audition Santé,8 place Saint Luc 69110 Sainte-Foy-lès-Lyon FR,45.749633,4.800062,Sainte-Foy-lès-Lyon,69110
Audioprothésiste Salon-de-Provence Audition Santé,Le Carré Foch Morgan Place Jules Morgan 13300 Salon-de-Provence FR,43.638849,5.093801,Salon-de-Provence,13300
Audioprothésiste Saumur Audition Santé,70 rue d'Orléans chez Optique Richard 49400 Saumur FR,47.258263,-0.080283,Saumur,49400
Audioprothésiste Sceaux AuditionSanté,2 avenue Charles Péguy 92330 Sceaux FR,48.779016,2.290673,Sceaux,92330
Audioprothésiste Sigean Audition Santé,11 avenue de Narbonne 11130 Sigean FR,43.028825,2.978136,Sigean,11130
Audioprothésiste Sisteron Audition Santé,11 Ter avenue Jean Jaurès Lieu dit La Gare 04200 Sisteron FR,44.188056,5.947107,Sisteron,04200
Audioprothésiste Soisy-sur-Seine Audition Santé,24 rue des Francs Bourgeois 91450 Soisy-sur-Seine FR,48.647431,2.451358,Soisy-sur-Seine,91450
Audioprothésiste Somain Audition Santé,7 rue Léon Gambetta 59490 Somain FR,50.358876,3.282128,Somain,59490
Audioprothésiste Souillac Audition Santé,52 bd Louis Jean Malvy 46200 Souillac FR,44.896268,1.478541,Souillac,46200
Audioprothésiste Strasbourg Audition Santé,1 boulevard de la Marne 67000 Strasbourg FR,48.583491,7.772429,Strasbourg,67000
Audioprothésiste Sète AuditionSanté,21 rue Jules Vallès 34200 Sète FR,43.410098,3.696706,Sète,34200
Audioprothésiste Talence Audition Santé,"25 rue Pacaris, Centre Commercial LECLERC Chez Opticien Atol 33400 Talence FR",44.79909,-0.583148,Talence,33400
Audioprothésiste Terrasson-Lavilledieu Audition Santé,46 avenue Victor Hugo 24120 Terrasson-Lavilledieu FR,45.130113,1.299044,Terrasson-Lavilledieu,24120
Audioprothésiste Tonneins Audition Santé,Place Jean Jaurès 47400 Tonneins FR,44.389327,0.307871,Tonneins,47400
Audioprothésiste Toulouse Audition Santé,44 allées Charles de Fitte 31300 Toulouse FR,42.462065,1.937261,Ur,66760
Audioprothésiste Toulouse Audition Santé,4 route de Bayonne 31300 Toulouse FR,42.462065,1.937261,Ur,66760
Audioprothésiste Toulouse La Roseraie Audition Santé,35 route d'Agde Quartier de la Roseraie 31500 Toulouse FR,42.462065,1.937261,Ur,66760
Audioprothésiste Toulouse Audition Santé,14 Boulevard Lazare Carnot 31000 Toulouse FR,43.602117,1.452143,Toulouse,31000
Audioprothésiste Troyes Audition Santé,13 boulevard du 1er RAM 10000 Troyes FR,48.304103,4.087616,Troyes,10000
Audioprothésiste Tulle Audition Santé,19 quai Alfred de Chammard 19000 Tulle FR,45.267142,1.771988,Tulle,19000
Audioprothésiste Vaison-la-Romaine AuditionSanté,"Résidence Tibère
Place Sus Auze 84110 Vaison-la-Romaine FR",44.239562,5.079265,Vaison-la-Romaine,84110
Audioprothésiste Vendôme Audition Santé,12 Faubourg Chartrain 41100 Vendôme FR,47.795477,1.067376,Vendôme,41100
Audioprothésiste Vernon Audition Santé,4 place d'Evreux 27200 Vernon FR,49.09201,1.482078,Vernon,27200
Audioprothésiste Versailles Audition Santé,1-3 rue Saint Simon 78000 Versailles FR,48.804003,2.13294,Versailles,78000
Audioprothésiste Versailles Audition Santé - LCA Bizaguet,8 rue de la Paroisse 78000 Versailles FR,48.808268,2.125506,Versailles,78000
Audioprothésiste Villedieu-les-Poêles-Rouffigny Audition Santé,15 rue Carnot 50800 Villedieu-les-Poêles-Rouffigny FR,48.839593,-1.221409,Villedieu-les-Poêles-Rouffigny,50800
Audioprothésiste Villeneuve le Roi AuditionSanté,70b rue du Général de Gaulle 94290 Villeneuve le Roi FR,48.735063,2.420033,Villeneuve-le-Roi,94290
Audioprothésiste Villeneuve-lez-Avignon AuditionSanté,"128 avenue du Général Leclerc
Rond-Point Bellevue - Le Félibrige B 30400 Villeneuve-lez-Avignon FR",43.958191,4.776707,Villeneuve-lès-Avignon,30400
Audioprothésiste Vitrolles Audition Santé,Place de la Victoire 13127 Vitrolles FR,43.45943,5.25017,Vitrolles,13127
Audioprothésiste Vénissieux Audition Santé,136 boulevard Irène Joliot - Centre Commercial Carrefour 69200 Vénissieux FR,45.716817,4.875738,Vénissieux,69200
Audioprothésiste Wimereux Audition Santé,90 ter rue Carnot 62930 Wimereux FR,50.76672,1.610972,Wimereux,62930
Audioprothésiste Yvetot Audition Santé,16 rue Guy de Maupassant 76190 Yvetot FR,49.618356,0.753688,Yvetot,76190
