shop_name,address,latitude,longitude,city,postcode
Audioprothésiste Abbeville Audition Santé,7 rue du Pont d'Amour 80100 ABBEVILLE FR,50.104848,1.832333,Abbeville,80100
Audioprothésiste Amiens Audition Santé,106 rue Alexandre DUMAS 80000 AMIENS FR,49.873833,2.289563,Amiens,80000
Audioprothésiste ARRAS Pasteur Audition Santé,15 rue Pasteur 62000 ARRAS FR,50.289046,2.780821,Arras,62000
Audioprothésiste ARRAS Gambetta Audition Santé,39 rue Gambetta 62000 ARRAS FR,50.289272,2.775238,Arras,62000
Audioprothésiste Aixe-sur-Vienne Audition Santé,2 rue Gambetta 87700 Aixe-sur-Vienne FR,45.795714,1.135355,Aixe-sur-Vienne,87700
Audioprothésiste Albertville Audition Santé,24 bis avenue Jean Jaurès 73200 Albertville FR,45.671102,6.386219,Albertville,73200
Audioprothésiste Albi Audition Santé,97 rue de Finlande 81000 Albi FR,43.925913,2.130841,Albi,81000
Audioprothésiste Ambarès-et-Lagrave Audition Santé,7 rue Edouard Herriot 33440 Ambarès-et-Lagrave FR,44.925825,-0.485054,Ambarès-et-Lagrave,33440
Audioprothésiste Anduze Audition Santé,28 avenue Pasteur Rollin 30140 Anduze FR,44.05131,3.985154,Anduze,30140
Audioprothésiste Angoulême Audition Santé,115 rue Saint Roch 16000 Angoulême FR,45.649862,0.168406,Angoulême,16000
Audioprothésiste Annonay Audition Santé,18 avenue Jean Jaurès Chez Optique Atol 07100 Annonay FR,45.243962,4.667807,Annonay,07100
Audioprothésiste Apt AuditionSanté,35 place Gabriel Péri 84400 Apt FR,43.875999,5.394814,Apt,84400
Audioprothésistes Passins Audition Santé,Zone du Lantey 38510 Arandon-Passins FR,45.68286,5.449363,Arandon-Passins,38510
Audioprothésiste Arcachon Héricart de Thury  Audition Santé,71 cours de Héricart de Thury 33120 Arcachon FR,44.660871,-1.167527,Arcachon,33120
Audioprothésiste Arcachon AuditionSanté,40 Cours Lamarque de Plaisance Chez Optique Merlin 33120 Arcachon FR,44.661156,-1.171963,Arcachon,33120
Audioprothésiste Argelès-sur-mer Audition Santé,11 avenue des Flamants roses 66700 Argelès-sur-mer FR,42.553052,3.011111,Argelès-sur-Mer,66700
Audioprothésiste Argentat Audition Santé,6 avenue du Jardin Public 19400 Argentat FR,45.093037,1.939536,Argentat-sur-Dordogne,19400
Audioprothésiste Arnac-Pompadour Audition Santé,14 place du Vieux Lavoir 19230 Arnac-Pompadour FR,45.398913,1.383245,Arnac-Pompadour,19230
Audioprothésiste Auch Audition Santé,6 allée Lucie Aubrac La porte d'Auch - Zone d'Endoumingue 32000 Auch FR,43.661439,0.597473,Auch,32000
Audioprothésiste Autun Audition Santé,2 Boulevard Mazagran 71400 Autun FR,46.954498,4.303266,Autun,71400
Audioprothésiste Avignon Eisenhower AuditionSanté,"12 avenue Eisenhower
Centre d'Affaires Eisenhower 84000 Avignon FR",43.939248,4.797294,Avignon,84000
Audioprothésiste Avranches Audition Santé,27 rue de la Constitution 50300 Avranches FR,48.685152,-1.359983,Avranches,50300
Audioprothésiste Bayonne Audition Santé,20 avenue du Maréchal Foch 64100 Bayonne FR,43.494035,-1.482401,Bayonne,64100
Audioprothésiste Bergerac Audition Santé,20 Rue des Carmes 24100 Bergerac FR,44.854098,0.487355,Bergerac,24100
Audioprothésiste Bessines-sur-Gartempe Audition Santé,19 avenue du 8 mai 1945 87250 Bessines-sur-Gartempe FR,46.108179,1.367907,Bessines-sur-Gartempe,87250
Audioprothésiste Bessé-sur-Braye Audition Santé,4 rue Jean Jaurès Chez Bessé Optique 72310 Bessé-sur-Braye FR,47.833874,0.751542,Bessé-sur-Braye,72310
Audioprothésiste Biganos Audition Santé,110 avenue de la Côte d'Argent 33380 Biganos FR,44.637785,-0.968034,Biganos,33380
Audioprothésiste Biscarrosse Audition Santé,153 avenue Georges Clemenceau 40600 Biscarrosse FR,44.395557,-1.164799,Biscarrosse,40600
Audioprothésiste Blois Audition Santé,2 Rue Denis Papin 41000 Blois FR,47.586353,1.335492,Blois,41000
Audioprothésiste Bohain-en-Vermandois AuditionSanté,"Corner chez Beaurain Opticien
21 rue Jean Jaurès 02110 Bohain-en-Vermandois FR",49.988062,3.436665,Bohain-en-Vermandois,02110
Audioprothésiste Bois-Guillaume Audition Santé,224 rue de la République 76230 Bois-Guillaume FR,49.470503,1.117034,Bois-Guillaume,76230
Audioprothésiste Bordeaux Audition Santé,14 place Amélie Raba Léon 33000 Bordeaux FR,44.830855,-0.603264,Bordeaux,33000
Audioprothésiste Bordeaux Audition Santé,3 Cours Portal 33000 Bordeaux FR,44.852322,-0.573568,Bordeaux,33000
Audioprothésiste Bouguenais Audition Santé,15 rue de La Chapelle 44340 Bouguenais FR,47.180143,-1.587672,Bouguenais,44340
Audioprothésiste Boulogne-sur-mer Audition Santé,9 rue Porte neuve Quartier Dernier Sou 62200 Boulogne-sur-mer FR,50.727137,1.617008,Boulogne-sur-Mer,62200
Audioprothésiste Bourg-Saint-Maurice Audition Santé,63 Route de Montrigon 73700 Bourg-Saint-Maurice FR,45.617324,6.768437,Bourg-Saint-Maurice,73700
Audioprothésiste Bourg-en-Bresse Audition Santé,20 rue Bichat 01000 Bourg-en-Bresse FR,46.20587,5.224996,Bourg-en-Bresse,01000
Audioprothésiste Agen Audition Santé,10 rue Albert Ferrasse ZAC de la Trenque 47550 Boé FR,44.18089,0.628818,Boé,47550
Audioprothésiste Brest Audition Santé,148 rue Jean Jaurès Quartier de l'octroi 29200 Brest FR,48.396702,-4.476201,Brest,29200
Audioprothésiste Brive La Gaillarde Audition Santé,91 Avenue Jacques et Bernadette Chirac 19100 Brive-la-Gaillarde FR,45.159093,1.514234,Brive-la-Gaillarde,19100
Audioprothésiste Bruyères Audition Santé,8 rue de Gérardmer 88600 Bruyères FR,48.200081,6.725628,Bruyères,88600
Audioprothésiste Bruz Audition Santé,7 avenue Jules Tricault 35170 Bruz FR,48.025374,-1.748009,Bruz,35170
Audioprothésiste Béziers Audition Santé,2 Boulevard Jean Bouin Chez les opticiens ACCORD 34500 Béziers FR,43.333612,3.25174,Béziers,34500
Audioprothésiste CHAUMONT Audition Santé,5 avenue des Etats-Unis 52000 CHAUMONT FR,48.118492,5.142064,Chaumont,52000
Audioprothésiste CORMEILLES EN PARISIS Audition Santé,24 avenue FOCH 95240 CORMEILLES EN PARISIS FR,48.970701,2.195963,Cormeilles-en-Parisis,95240
Audioprothésiste Cachan Audition Santé,2/4 place Jacques Carat Ancienne place Ovale 94230 Cachan FR,48.793178,2.336042,Cachan,94230
Audioprothésiste Cahors Audition Santé,105 boulevard Gambetta 46000 Cahors FR,44.444568,1.441799,Cahors,46000
Audioprothésiste Carbonne Audition Santé,32 bis Place de la République 31390 Carbonne FR,43.296835,1.224742,Carbonne,31390
Audioprothésiste Carpentras AuditionSanté,"Les Jardins de la Fontaine
284 Avenue du Comtat Venaissin 84200 Carpentras FR",44.050521,5.054885,Carpentras,84200
Audioprothésiste Castelnau-le-Lez Audition Santé,1 Allée Marie Curie 34170 Castelnau-le-Lez FR,43.632374,3.899318,Castelnau-le-Lez,34170
Audioprothésiste Castets Audition Santé,48 rue Sainte-Hélène 40260 Castets FR,43.882151,-1.1478,Castets,40260
Audioprothésiste Caussade Audition Santé,14 rue des Récollets 82300 Caussade FR,44.162835,1.537341,Caussade,82300
Audioprothésiste Cavaillon Audition Santé,15 cours Gambetta 84300 Cavaillon FR,43.836833,5.0403,Cavaillon,84300
Audioprothésiste Cazères Audition Santé,10 place d'Armes 31220 Cazères FR,43.205858,1.086869,Cazères,31220
Audioprothésiste Cenon Audition Santé,Centre Commercial La Morlette Galerie Casino Supermarché 33150 Cenon FR,44.853526,-0.518498,Cenon,33150
Audioprothésiste Cenon Pelletan AuditionSanté,55 rue Camille Pelletan 33150 Cenon FR,44.857598,-0.51978,Cenon,33150
Audioprothésiste Chagny Audition Santé,14 avenue du Général de Gaulle 71150 Chagny FR,46.911929,4.754595,Chagny,71150
Audioprothésiste Champigny Audition Santé,8 rue Albert Thomas 94500 Champigny-sur-Marne FR,48.811207,2.510467,Champigny-sur-Marne,94500
Audioprothésiste Chauny AuditionSanté,"Corner chez VISION 9
39 rue de la République 02300 Chauny FR",49.614224,3.219351,Chauny,02300
Audioprothésiste Chauvigny Audition Santé,45 ter route de Poitiers 86300 Chauvigny FR,46.567917,0.630895,Chauvigny,86300
Audioprothésiste Chinon Audition Santé,86 Quai Jeanne d'Arc 37500 Chinon FR,47.165406,0.242665,Chinon,37500
Audioprothésiste Cholet Audition Santé,10 bis place du Mail 49300 Cholet FR,47.05974,-0.882483,Cholet,49300
Audioprothésiste Saint-Auban Audition Santé,14 cours Pechiney 04600 Château-Arnoux-Saint-Auban FR,44.093367,6.008905,Château-Arnoux-Saint-Auban,04160
Audioprothésiste Châteauneuf-les-Martigues Audition Santé,7 avenue du 4 septembre 13220 Châteauneuf-les-Martigues FR,43.38311,5.165608,Châteauneuf-les-Martigues,13220
Audioprothésiste Châteauroux Audition Santé,23 rue de la Poste 36000 Châteauroux FR,46.810502,1.693369,Châteauroux,36000
Audioprothésiste Châtellerault Audition Santé,23 place Dupleix 86100 Châtellerault FR,46.818341,0.5424,Châtellerault,86100
Audioprothésiste Cluny Audition Santé,20 rue Lamartine Chez Optique Wolff 71250 Cluny FR,46.433226,4.659165,Cluny,71250
Audioprothésiste Colmar Audition Santé,7 avenue de Fribourg 68000 Colmar FR,48.06969,7.362171,Colmar,68000
Audioprothésiste Colombiers Audition Santé,4 traverse de Béziers 34440 Colombiers FR,43.313697,3.145023,Colombiers,34440
Audioprothésiste Combs-la-Ville Audition Santé,39 Avenue de la république Chez Opticien ATOL 77380 Combs-la-Ville FR,48.665669,2.551608,Combs-la-Ville,77380
Audioprothésiste Condé-sur-l'Escaut Audition Santé,87 rue Gambetta 59163 Condé-sur-l'Escaut FR,50.450429,3.593843,Condé-sur-l'Escaut,59163
Audioprothésiste Corbeil-Essonnes Audition Santé,80 rue Ferray 91100 Corbeil-Essonnes FR,48.607277,2.473617,Corbeil-Essonnes,91100
Audioprothésiste Cornebarrieu Audition Santé,1 route d’Aussonne 31700 Cornebarrieu FR,43.65497,1.323724,Cornebarrieu,31700
Audioprothésiste Couëron Audition Santé,14 Rue Alexandre Olivier 44220 Couëron FR,47.212602,-1.726196,Couëron,44220
Audioprothésiste Dijon Audition Santé,11 rue Vaillant 21000 DIJON FR,47.321226,5.044226,Dijon,21000
Audioprothésiste Dax Audition Santé,28 place Joffre Résidence Le Sablar 40100 Dax FR,43.713411,-1.055974,Dax,40100
Audioprothésiste Dax AuditionSanté,28 rue Saint-Pierre 40100 Dax FR,43.708788,-1.050716,Dax,40100
Audioprothésiste Descartes Audition Santé,1 place de l’Hôtel de Ville Place Descartes 37160 Descartes FR,46.973728,0.698764,Descartes,37160
Audioprothésiste Digne-les-Bains Audition Santé,3 Rue Andre Honnorat 04000 Digne-les-Bains FR,44.091322,6.233119,Digne-les-Bains,04000
Audioprothésiste Dives-sur-Mer Audition Santé,22 place de la République 14160 Dives-sur-Mer FR,49.286718,-0.09614,Dives-sur-Mer,14160
Audioprothésiste Douai Audition Santé,12 rue Victor Hugo 59500 Douai FR,50.371224,3.084699,Douai,59500
Audioprothésiste Dourdan Audition Santé,4 place du Général de Gaulle 91410 Dourdan FR,48.529396,2.011163,Dourdan,91410
Audioprothésiste Draveil Audition Santé,28 place de la République Place du Marché 91210 Draveil FR,48.685832,2.410328,Draveil,91210
Audioprothésiste Dreux Audition Santé,2 avenue de Melsungen 28100 Dreux FR,48.731122,1.364842,Dreux,28100
Audioprothésiste Eauze Audition Santé,10 rue Saint July 32800 Eauze FR,43.8608,0.101252,Eauze,32800
Audioprothésiste Ecommoy Audition Santé,122 Route du Mans 72220 Ecommoy FR,47.837762,0.264002,Écommoy,72220
Audioprothésiste Egletons Audition Santé,30 rue François Monéger 19300 Egletons FR,45.407333,2.04514,Égletons,19300
Audioprothésiste Epinal Audition Santé,15 chemin de la Belle au Bois Dormant 88000 Epinal FR,48.198063,6.465006,Épinal,88000
Audioprothésiste Ernée Audition Santé,36 place Renault Morlière 53500 Ernée FR,48.297104,-0.938593,Ernée,53500
Audioprothésiste Evry-Courcouronnes Audition Santé,5 Pl Pierre Mendes France 91000 Evry-Courcouronnes FR,48.626856,2.429517,Évry,91000
Audioprothésiste Eymet Audition Santé,5 bis avenue du 6 juin 1944 24500 Eymet FR,44.666694,0.399554,Eymet,24500
Audioprothésiste Eysines AuditionSanté,204 avenue du Médoc 33320 Eysines FR,44.887628,-0.644417,Eysines,33320
Audioprothésiste Falaise Audition Santé,36 place Belle Croix 14700 Falaise FR,48.895815,-0.200177,Falaise,14700
Audioprothésiste Fleurance Audition Santé,95 rue Pasteur 32500 Fleurance FR,43.849672,0.663724,Fleurance,32500
Audioprothésiste Foix Audition Santé,34 rue Delcassé 09000 Foix FR,42.964738,1.608107,Foix,09000
Audioprothésiste Frontignan Audition Santé,33 rue Saint Paul 34110 Frontignan FR,43.447066,3.755182,Frontignan,34110
Audioprothésiste Fécamp Audition Santé,2 place Bigot 76400 Fécamp FR,49.757601,0.378235,Fécamp,76400
Audioprothésiste Gap Audition Santé,28 rue pasteur 05000 GAP FR,44.559909,6.078723,Gap,05000
Audioprothésiste Gaillon Audition Santé,"8 bis, rue des Arrières Fossés 27600 Gaillon FR",49.159741,1.331745,Gaillon,27600
Audioprothésiste Gannat Audition Santé,71 Grande rue 03800 Gannat FR,46.099625,3.19787,Gannat,03800
Audioprothésiste Givors Audition Santé,2 place Carnot 69700 Givors FR,45.585606,4.771575,Givors,69700
Audioprothésiste Gourdon Audition Santé,93 boulevard Aristide Briand 46300 Gourdon FR,44.736002,1.380638,Gourdon,46300
Audioprothésiste Gradignan Audition Santé,6 allée de Carthon Ferrière 33170 Gradignan FR,44.785826,-0.601781,Gradignan,33170
Audioprothésiste Granville Audition Santé,Pôle Santé - 98 rue Marie Fougeray 50400 Granville FR,48.833318,-1.550736,Granville,50400
Audioprothésiste Groix AuditionSanté,La conserverie - Port-Tudy 56590 Groix FR,47.639256,-3.444642,Groix,56590
Audioprothésiste Guilers Audition Santé,49 rue Charles de Gaulle 29820 Guilers FR,48.424576,-4.558145,Guilers,29820
Audioprothésiste Gujan-Mestras AuditionSanté,2 allée Mansart 33470 Gujan-Mestras FR,44.617114,-1.073034,Gujan-Mestras,33470
Audioprothésiste Ham AuditionSanté,"Corner chez HAM A VUE
16 rue de Noyon 80400 Ham FR",49.745479,3.075436,Ham,80400
Audioprothésiste Hendaye Audition Santé,Place de la République 64700 Hendaye FR,43.358084,-1.774826,Hendaye,64700
Audioprothésiste Hyères Audition Santé,4 avenue Ernest Millet 83400 Hyères FR,43.117696,6.127733,Hyères,83400
Audioprothésiste Ille-sur-Têt Audition Santé,47 avenue Pasteur 66130 Ille-sur-Têt FR,42.670035,2.62065,Ille-sur-Têt,66130
Audioprothésiste Jarnac Audition Santé,6 avenue d'Ecosse 16200 Jarnac FR,45.68579,-0.173255,Jarnac,16200
Audioprothésiste Joinville Audition Santé,"Avenue de Lorraine ZI du Rongeant ""chez Progrès Optic"" 52300 Joinville FR",48.449471,5.158613,Joinville,52300
Audioprothésiste Jouy le moutier AuditionSanté,60 boulevard d'Ecancourt 95280 Jouy le Moutier FR,49.011331,2.05118,Jouy-le-Moutier,95280
Audioprothésiste L'Isle-Jourdain Audition Santé,3 rue du 14 juillet 32600 L'Isle-Jourdain FR,43.613709,1.08138,L'Isle-Jourdain,32600
Audioprothésiste  LEZIGNAN-CORBIERES Audition Santé,16 rue des Garrigues 11200 LEZIGNAN-CORBIERES FR,43.186639,2.756295,Lézignan-Corbières,11200
Audioprothésiste La Bresse Audition Santé,5 rue Paul Claudel 88250 La Bresse FR,48.005997,6.877571,La Bresse,88250
Audioprothésiste La Chapelle-sur-Erdre Audition Santé,Pôle Paramédical - 31 rue Hervé Le Guyader 44240 La Chapelle-sur-Erdre FR,47.288565,-1.55634,La Chapelle-sur-Erdre,44240
Audioprothésiste La Ciotat Audition Santé,34 boulevard Clémenceau 13600 La Ciotat FR,43.178012,5.610904,La Ciotat,13600
Audioprothésiste La Crau AuditionSanté,14 boulevard de la République 83260 La Crau FR,43.148453,6.073838,La Crau,83260
Audioprothésiste La Londe Les Maures AuditionSanté,147 avenue Albert Roux 83250 La Londe Les Maures FR,43.13733,6.233046,La Londe-les-Maures,83250
Audioprothésiste La Rochefoucauld Audition Santé,1 avenue Gambetta 16110 La Rochefoucauld FR,45.739063,0.386538,La Rochefoucauld,16110
Audioprothésiste Lamballe Audition Santé,17 Rue du Docteur Lavergne 22400 Lamballe FR,48.467151,-2.51917,Lamballe,22400
Audioprothésiste Landerneau Audition Santé,5 rue François Pengam 29800 Landerneau FR,48.452711,-4.252387,Landerneau,29800
Audioprothésiste Langoiran AuditionSanté,25 route de Créon 33550 Langoiran FR,44.716,-0.389731,Langoiran,33550
Audioprothésiste Langon Audition Santé,59 rue Maubec 33210 Langon FR,44.553196,-0.245867,Langon,33210
Audioprothésiste Lapugnoy Audition Santé,247 rue Jean Jaurès 62122 Lapugnoy FR,50.515547,2.537394,Lapugnoy,62122
Audioprothésiste Latour-Bas-Elne Audition Santé,242 Avenue d'Elne Parking Intermarché Centre commercial Espace Sud 66200 Latour-Bas-Elne FR,42.607821,2.966165,Elne,66200
Audioprothésiste Lavelanet Audition Santé,24 rue Jean Jaurès 09300 Lavelanet FR,42.931691,1.846493,Lavelanet,09300
Audioprothésiste Le Bugue Audition Santé,69 avenue de la libération 24260 Le Bugue FR,44.912095,0.924436,Le Bugue,24260
Audioprothésiste Le Creusot Audition Santé,63 rue du Maréchal Foch 71200 Le Creusot FR,46.804981,4.43847,Le Creusot,71200
Audioprothésiste Le Haillan Audition Santé,3 Square Condorcet 33185 Le Haillan FR,44.870488,-0.675714,Le Haillan,33185
Audioprothésiste Le Mans Audition Santé,23 avenue de Général Leclerc 72000 Le Mans FR,47.999541,0.196235,Le Mans,72000
Audioprothésiste Le Plessis-Trévise Audition Santé,42 Avenue Ardouin 94420 Le Plessis-Trévise FR,48.808603,2.574255,Le Plessis-Trévise,94420
Audioprothésiste Le Raincy Audition Santé,118 avenue de la Résistance 93340 Le Raincy FR,48.898088,2.51656,Le Raincy,93340
Audioprothésiste Le Rheu Audition Santé,Place de l'église Chez Agathe et Pierre Opticien 35650 Le Rheu FR,48.100576,-1.79523,Le Rheu,35650
Audioprothésiste Lesneven Audition Santé,4 rue de la Marne 29260 Lesneven FR,48.571652,-4.323411,Lesneven,29260
Audioprothésiste Lesparre-Medoc AuditionSanté,14 route de Bordeaux 33340 Lesparre-Medoc FR,45.300555,-0.933155,Lesparre-Médoc,33340
Audioprothésiste Leucate Audition Santé,Bât Ccial Carrefour hameau Malagaïto Corner chez Vision - Centre commercial Malgaito Sud 11370 Leucate FR,42.906434,3.044346,Leucate,11370
Audioprothésiste Lille Bayard Audition Santé,114 rue Bayard 59000 Lille FR,50.618939,3.054252,Lille,59000
Audioprothésiste Lille Molinel Audition Santé - World of Hearing,80 rue du Molinel 59000 Lille FR,50.634149,3.066958,Lille,59160
Audioprothésiste Limoges Audition Santé,72 bis avenue Garibaldi 87000 Limoges FR,45.838324,1.258736,Limoges,87000
Audioprothésiste Longeville-les-Metz AuditionSanté,96 rue du Général de Gaulle 57050 Longeville-les-Metz FR,49.113137,6.136248,Longeville-lès-Metz,57050
Audioprothésiste Lorient Audition Santé,"38, cours de la Bôve 56100 Lorient FR",47.747732,-3.359171,Lorient,56100
Audioprothésiste Loudun Audition Santé,1 place de la porte de Chinon Chez Optique Krys 86200 Loudun FR,47.008632,0.087641,Loudun,86200
Audioprothésiste Lunéville AuditionSanté,13 rue du foyer familial 54300 Lunéville FR,48.586647,6.508867,Lunéville,54300
Audioprothésiste Léognan Audition Santé,3 Cours Maréchal De Lattre De Tassigny 33850 Léognan FR,44.728959,-0.598664,Léognan,33850
Audioprothésiste Maisons-Alfort AuditionSanté,59 avenue du Général de Gaulle 94700 Maisons-Alfort FR,48.802226,2.429578,Maisons-Alfort,94700
Audioprothésiste Manosque Audition Santé,698 avenue Georges Pompidou 04100 Manosque FR,43.826668,5.781989,Manosque,04100
Audioprothésiste Mantes-la-Jolie Audition Santé,59 rue Nationale 78200 Mantes-la-Jolie FR,48.989769,1.71561,Mantes-la-Jolie,78200
Audioprothésiste Marmande Audition Santé,10 avenue Charles Boisvert 47200 Marmande FR,44.494087,0.172633,Marmande,47200
Audioprothésiste Marquise Audition Santé,35 Place Louis le Sénéchal 62250 Marquise FR,50.813376,1.704221,Marquise,62250
Audioprothésiste Marseille Audition Santé,4 rue du Dr Schweitzer 13006 Marseille FR,43.283544,5.387026,Marseille,13006
Audioprothésiste Marvejols Audition Santé,3 Rue de la république 48100 Marvejols FR,44.553062,3.290295,Marvejols,48100
Audioprothésiste Mauguio Audition Santé,95 Avenue de la mer Le bellevue 34130 Mauguio FR,43.612567,4.006598,Mauguio,34130
Audioprothésiste Maule AuditionSanté,8 place de la Mairie 78580 Maule FR,48.909214,1.849255,Maule,78580
Audioprothésiste Melesse Audition Santé,ZA La Metairie 35520 Melesse FR,48.215244,-1.703048,Melesse,35520
Audioprothésiste Mende Audition Santé,5 allée Piencourt 48000 Mende FR,44.518613,3.50211,Mende,48000
Audioprothésiste Mennecy Audition Santé,47 Boulevard Charles de Gaulle 91540 Mennecy FR,48.564989,2.43785,Mennecy,91540
Audioprothésiste Metz AuditionSanté,10 rue des Armoisières 57000 Metz FR,49.077765,6.186174,Metz,57000
Audioprothésiste Mimizan AuditionSanté,21 avenue de Bordeaux 40200 Mimizan FR,44.204072,-1.225447,Mimizan,40200
Audioprothésiste Miramas Audition Santé,22 avenue Charles de Gaulle 13140 Miramas FR,43.581896,5.001208,Miramas,13140
Audioprothésiste Mirande Audition Santé,2 Rue Pierre Lamaguere 32300 Mirande FR,43.514125,0.404687,Mirande,32300
Audioprothésiste Mirebeau sur Beze Audition Santé,6b rue Paul Auban Centre commercial Mirebelle 21310 Mirebeau sur Beze FR,47.393022,5.309437,Mirebeau-sur-Bèze,21310
Audioprothésiste Moissac Audition Santé,24 rue Malaveille 82200 Moissac FR,44.104032,1.087428,Moissac,82200
Audioprothésiste Montceau-les-Mines Audition Santé,15 Quai Général de Gaulle 71300 Montceau-les-Mines FR,46.673923,4.361922,Montceau-les-Mines,71300
Audioprothésiste Montigny-le-Bretonneux Audition Santé,25 rue Marcel Proust 78180 Montigny-le-Bretonneux FR,48.779413,2.041648,Montigny-le-Bretonneux,78180
Audioprothésiste Montluçon Audition Santé,108 Boulevard de Courtais 03100 Montluçon FR,46.339134,2.607465,Montluçon,03100
Audioprothésiste Montrichard Audition Santé,45 rue nationale 41400 Montrichard FR,47.342965,1.185307,Montrichard Val de Cher,41400
Audioprothésiste Morcenx-la-Nouvelle AuditionSanté,Avenue Gaston Nelson Centre Commercial Super U Les Grands Carolins 40110 Morcenx-la-Nouvelle FR,44.022952,-0.924901,Morcenx,40110
Audioprothésiste Mordelles Audition Santé,1 avenue des platanes 35310 Mordelles FR,48.079989,-1.835955,Mordelles,35310
Audioprothésiste Morlaix Audition Santé,4 Place Cornic 29600 Morlaix FR,48.579241,-3.829966,Morlaix,29600
Audioprothésiste Moutiers Audition Santé,24 Place Saint Antoine 73600 Moutiers FR,45.484733,6.531752,Moûtiers,73600
Audioprothésiste Mulhouse Audition Santé,18 rue de Metz 68100 Mulhouse FR,42.462065,1.937261,Ur,66760
Audioprothésiste Mussidan Audition Santé,1 Route de Bergerac 24400 Mussidan FR,45.028706,0.369986,Mussidan,24400
Audioprothésiste Mézidon-Canon Audition Santé,24 Rue Voltaire 14270 Mézidon-Canon FR,49.071683,-0.073106,Mézidon Vallée d'Auge,14270
Audioprothésiste Nice Audition Santé,11 boulevard Victor Hugo 06000 NICE FR,43.699834,7.265943,Nice,06000
Audioprothésiste Nancy Audition Santé,138 rue Saint-Dizier 54000 Nancy FR,48.686413,6.185593,Nancy,54000
Audioprothésiste Nantes Audition Santé,31 boulevard Guist'Hau 44000 Nantes FR,47.217398,-1.568486,Nantes,44000
Audioprothésiste Narbonne Victor Hugo Audition Santé,7 bis quai Victor Hugo 11100 Narbonne FR,43.181378,3.008148,Narbonne,11100
Audioprothésiste Narbonne La Coupe Audition Santé,"Domaine de la Coupe , Route de Perpignan 11100 Narbonne FR",43.183679,2.999147,Narbonne,11100
Audioprothésiste Niort Audition Santé,8 rue d'Inkermann Therapole 79000 Niort FR,46.315553,-0.454915,Niort,79000
Audioprothésiste Noisy Le Grand Audition Santé,204 rue Pierre Brossolette 93160 Noisy Le Grand FR,48.84869,2.551615,Noisy-le-Grand,93160
Audioprothésiste Nérac Audition Santé,7 avenue Mondenard 47600 Nérac FR,44.134628,0.339866,Nérac,47600
Audioprothésiste Oberhausbergen Audition Santé,"75, route de Saverne 67205 Oberhausbergen FR",48.605705,7.684731,Oberhausbergen,67205
Audioprothésiste Objat Audition Santé,52 avenue Jean Lascaux 19130 Objat FR,45.337913,1.366446,Lascaux,19130
Audioprothésiste Orvault Audition Santé,105 rue de la Patouillerie 44700 Orvault FR,47.246758,-1.578561,Orvault,44700
Audioprothésiste Ozoir-la-Ferrière Audition Santé,17 Avenue du général Leclerc 77330 Ozoir-la-Ferrière FR,48.765399,2.672912,Ozoir-la-Ferrière,77330
Audioprothésiste Paimpol Audition Santé,3 Place de Bretagne 22500 Paimpol FR,48.77733,-3.050088,Paimpol,22500
Audioprothésiste Parentis AuditionSanté,"CC de la Côte d’Argent Intermarché
71 route de Pontenx 40160 Parentis FR",44.298804,-1.102987,Parentis-en-Born,40160
Audioprothésiste Paris Audition Santé Brochant,10 rue Brochant 75017 Paris FR,48.888468,2.317551,Paris,75017
Audioprothésiste Paris Audition Santé Réaumur,107 rue Réaumur 75002 Paris FR,48.86798,2.343971,Paris,75002
Audioprothésiste Paris Audition Santé Mozart,30 Avenue Mozart 75016 Paris FR,48.856312,2.271223,Paris,75016
Audioprothésiste Paris Audition Santé Sèvres - World of Hearing,77 rue de Sèvres 75006 Paris FR,48.849682,2.323131,Paris,75006
Audioprothésiste Paris Audition Santé Saint Dominique,73-75 rue Saint-Dominique 75007 Paris FR,48.85983,2.309636,Paris,75007
Audioprothésiste Paris Audition Santé Entrepreneurs,40 rue des Entrepreneurs 75015 Paris FR,48.846265,2.286223,Paris,75015
Audioprothésiste Paris Opéra Audition Santé - LCA Bizaguet,20 rue Thérèse 75001 Paris FR,48.86653,2.334531,Paris,75001
Audioprothésiste Paris Magenta Audition Santé - LCA Bizaguet,88 boulevard Magenta 75010 Paris FR,48.876897,2.355766,Paris,75010
Audioprothésiste Paris Pyrénées Audition Santé - Philippe Metzger,340 rue des Pyrénées 75020 Paris FR,48.873865,2.388862,Paris,75020
Audioprothésiste Paris Gambetta Audition Santé,196 rue des Pyrénées 75020 Paris FR,48.863856,2.399463,Paris,75020
Audioprothésiste Paris Est Audition Santé,37 rue des Pyrénées 75020 Paris FR,48.850327,2.406149,Paris,75020
Audioprothésiste Paris Daumesnil Audition Santé,249 avenue Daumesnil 75012 Paris FR,48.837556,2.401706,Paris,75012
Audioprothésiste Parthenay Audition Santé,13 boulevard de la Meilleraye 79200 Parthenay FR,46.64561,-0.249164,Parthenay,79200
Audioprothésiste Pessac Audition Santé,110 bis avenue Pasteur 33600 Pessac FR,44.803314,-0.63831,Pessac,33600
